	Class ID	Preferred Label	Synonyms	Definitions	Obsolete	Semantic Types	Parents
61826	C18660	Bone and Connective Tissue Pathology	Bone and Connective Tissue Pathology	The branch of pathology that focuses the causes and nature and effects of diseases of the bone and connective tissues.	False		C18189
62567	C17768	Cellular Morphology	Cell Morphology|Morphology, Cellular|Cellular Morphology|CEMORPH	Cellular morphology is the form and structure of cells, and its relation to cell function, or the scientific study thereof.	False		C17943
62569	C17760	Radiation Oncology	Radiation Oncology|oncology, radiation	The study of the effects of ionizing radiation for treatment of tumors.	False		C17837
62787	C94518	Nutrigenomics	Nutrigenomics|nutrigenomics		False		C84343
63291	C16320	Bacteriology	Bacteriology	The branch of science that studies bacteria, especially in relation to medicine and agriculture.	False		C16851
63677	C16589	Food Microbiology	Food Microbiology	The field of study concerned with the study of food-borne microorganisms.	False		C16851
64689	C18905	Occupational Carcinogenesis	Occupational Carcinogenesis	Studies of carcinogens encountered through occupational exposure. The carcinogens can be of any type: chemicals, electromagnetic fields, UV, viruses, etc. Many of these agents may also be commonly encountered outside the occupational environment (e.g., UV) but in such cases they are not coded in this category; for farmers and sailors, UV is an occupational carcinogen. Epidemiologic studies will usually clearly identify occupational carcinogens but in experimental studies or analyses of carcinogenic mechanisms, a judgment must be made as to whether the primary means of exposure is occupational and thus requires selection of SIC 28; for example, one could be exposed to benzene in various settings, but the most frequent exposure risk would be occupational. For chemicals with which you are unfamiliar, consult the Merck Index to determine whether the chemical is used in manufacturing, agriculture, or other occupational setting.	False		C18057
64693	C18907	Ocular Pathology	Ocular Pathology	Subdiscipline of pathology with a focus on vision and the eye.	False		C18189
64695	C18903	Nucleic Acid Biochemistry, Synthesis	Nucleic Acid Biochemistry, Synthesis	Research into natural and artificial means for synthesis of nucleic acids.	False		C19350
65038	C16749	Internal Medicine	Internal Medicine|General Medicine|Medicine, Internal	A medical specialty concerned with the diagnosis of diseases of the internal organs and non-surgical treatments.	False		C17153
65421	C192580	Allergy Medicine Specialty	Allergy Medicine Specialty|Allergy	A medical specialty concerned with the diagnosis, treatment and management of allergies and allergy-related disorders.	False		C16749
66028	C86055	Cardiology	Cardiology	The branch of medicine dealing with the heart and its diseases.	False		C17153
66049	C105700	Urological Surgery	Urological Surgery	A surgical specialty concerned with surgical treatment of the diseases of the urinary tract and urogenital system.	False		C17173
66290	C16658	Gynecology	GYN|Gynecology	The branch of medicine that deals with the diseases and hygiene of women.	False		C16749
66988	C17851	Pediatric Surgery	Pediatric Surgery	A surgical specialty that focuses on surgical treatment of diseases of children.	False		C17173
66989	C17855	Pediatric Neurology	Pediatric Neurology|neurology, pediatric	A branch of neurology that focuses on diseases of children.	False		C16962
66990	C17852	Pediatric Oncology	Pediatric Oncology|Oncology, Pediatric	The medical specialty that focuses on tumors in children.	False		C17837
66991	C17854	Neurologic Oncology	Neurologic Oncology|Neuro-Oncology|oncology, neurologic	The branch of oncology concerned with the study, diagnosis, and treatment of cancers of the nervous system.	False		C17837
66992	C17856	Dermatologic Oncology	Dermatologic Oncology|oncology, dermatologic	The branch of oncology concerned with the study, diagnosis, and treatment of skin cancer.	False		C17837
68091	C18734	Developmental Cell Biology	Developmental Cell Biology	The branch of cell biology concerned with the cellular changes that take place between fertilization and maturity.	False		C16501
69370	C201965	Hematology and Oncology	Hematology and Oncology|Hematology/Oncology|HemOnc	A medical specialty that focuses on diseases and disorders of the blood and blood-forming tissues, including hematopoietic and lymphoid cell neoplasms.	False		C16749
71014	C182016	Z-Stacking	Focus Stack|Focal Plane Merging|Focus Stacking|Z-Stack|Z-Stacking	A digital image processing method which combines multiple images taken at different focal distances to create a composite image with a greater depth of field than is possible for a single image.	False		C17606
71769	C89796	Family Practice	Family Medicine|Family Practice|General Practice	A medical specialty that provides comprehensive health care for all members of a family regardless of age or sex.	False		C17153
73100	C18781	Experimental Pathology, Other Than Tumors	Experimental Pathology, Other Than Tumors	Basic research in the field of pathology, which excludes that concerned with tumors and cancer.	False		C19164
73102	C18780	Experimental Ophthalmology	Experimental Ophthalmology	Basic research in the field of ophthalmology.	False		C16939
73107	C18782	Experimental Pathology, Tumors	Experimental Pathology, Tumors	The study of the neoplastic process by studying artificially produced tumors.	False		C19164
73108	C18786	Extra-Nuclear Genetics	Extra-Nuclear Genetics	The genetics of extra-nuclear DNA, eg. Mitochondria and chloroplasts.	False		C16624
73687	C18273	Cardiovascular Pathology	Cardiovascular Pathology	Cardiovascular Pathology; a subdiscipline of pathology focusing on diseases of the heart or circulatory system.	False		C18189
73690	C18275	Pulmonary Pathology	Pulmonary Pathology	The branch of pathology that focuses the causes and nature and effects of diseases of the lungs and respiratory structures.	False		C18189
74558	C105689	Physical Medicine and Rehabilitation	Physical Medicine and Rehabilitation|Rehabilitation Medicine|Physiatry	A medical specialty focused on restoring functional ability and quality of life to people with physical impairments or disabilities.	False		C17153
74945	C26019	Viral Carcinogenesis	Viral Carcinogenesis	Studies of the role of viruses as factors or cofactors in the etiology of human and animal cancer.	False		C18678
74950	C26018	Biological Carcinogenesis, Non-Viral	Biological Carcinogenesis, Non-Viral	Studies of the role of non-viral biological agents as factors or cofactors in the etiology of human and animal cancer.	False		C18678
75166	C19155	Patterns of Care	Patterns of Care	Addresses geographic variability in medical practice in the United States and the medical and nonmedical factors that create this variability.	False		C17039
76405	C49019	Metabolomics	Metabolic Profiling|Metabolomics	Metabolomics is the study of the biological metabolic profile of a cellular specimen in a specific environment at an isolated timepoint. This discipline depicts the physiological states of cells and organisms by focusing on carbohydrates, lipids, and other metabolites. Several analytical techniques are utilized to quantify the metabolic content of specimens such as mass spectrometry and electrophoretic applications.	False		C17964
77129	C19063	Thrombosis / Hemostasis / Platelet Function	Thrombosis / Hemostasis / Platelet Function		False		C16405
77131	C19062	Thoracic Oncology	Thoracic Oncology	The branch of oncology concerned with the study, diagnosis, and treatment of neoplasms of the thorax.	False		C17837
77153	C188483	Cheminformatics	Cheminformatics	A branch of informatics focused on chemical data.	False		C18145
78640	C190606	Real World Value Mapping	Real World Value Mapping|Real World Value Map|RWV	The representation of the stored pixel values of referenced images into some Real World value in defined units. This allows the capture of retrospectively determined mappings, e.g., for values that cannot be determined at the time of image acquisition and encoding.	False		C142485
78806	C17109	Rural Health	Rural Health	The study of health and health care delivery in rural environments.	False		C19155
79140	C17195	Thoracic Surgery	Surgery, Thoracic|Thoracic Surgery	A branch of medicine dealing with the use of surgery to treat diseases of the chest and lungs.	False		C17173
79347	C19418	Genetic Programming	Genetic Algorithm|Genetic Programming	A method for obtaining an optimal programming algorithm.  Thousands of randomly created programs are progressively evolved over time using an evolutionary search based on the principle of survival of the fittest.  Mechanisms include the equivalent of recombination, mutation, duplication, deletion, etc.	False		C17147
79349	C19410	Membrane Structure / Transport Phenomena	Membrane Structure / Transport Phenomena		False		C19408
79691	C19071	Toxicology, Antidotes/Treatment	Toxicology, Antidotes/Treatment	The treatment or medication that can be administered to a person who has been exposed to a toxic substance	False		C17206
79692	C19070	Analytical Toxicology	Toxicology, Analytical|Analytical Toxicology	A quantitative analysis of a toxic substance.	False		C17206
79695	C19073	Toxicology, Non-Drug	Toxicology, Non-Drug	The toxicology of compounds other than those used for therapy.	False		C17206
79697	C19072	Toxicology, Biologicals	Toxicology, Biologicals	The study of the toxicology of biologics.	False		C17206
80003	C16985	Photochemistry	Photochemistry	The branch of chemistry that focuses on the changes that chemicals undergo when exposed to light.	False		C16421
81900	C16603	Gastroenterology	Gastroenterology	The branch of medicine that focuses on diagnosis and treatment of conditions affecting the gastrointestinal tract.	False		C16749
83572	C201530	Binary Mask	Binary Mask	A mapping of pixels used to define a region of interest in an image. Each pixel is designated as either belonging to the region of interest or part of the background by using ones or zeros, respectively.	False		C142485
84946	C18268	Community Health	Community Health	Community health; community-focused health delivery systems.	False		C17039
84949	C18269	Manpower	Manpower	The labor force available to do work on a project	False		C19614
85564	C19430	Membrane Biology	Membrane Biology	The study of the protoplasmic boundary of all cells that controls permeability and may serve other functions through surface specializations; e.g., active ion transport absorption by formation of pinocytotic vesicles; receptor-mediated antigen recognition, etc.	False		C17992
85570	C19435	Human Pathology	Human Pathology	Branch of medicine concerned with the cause, origin, and nature of human disease, including the changes occurring as a result of disease. (from EPA Terminology Reference System)	False		C18189
86740	C45970	Deidentification	Deidentification|de-identification|DID	Removal of text elements that would make data individually identifiable.	False		C47925
88708	C19142	Population Biology	Population Biology	Studies theoretical aspects of the biology of populations, particularly in the areas of ecology, genetics, demography, and epidemiology.	False		C19061
90525	C19393	Cell Energetics	Cell Energetics	The study of the energy changes involved in physical and chemical reactions within a cell.	False		C19605
90734	C19535	UV, Systematic Effects	UV, Systematic Effects		False		C17055
90741	C19533	Vertebrate Biology	Vertebrate Biology	A biological science concerned with the origin, structure, development, growth, function, genetics, and reproduction of animals having a vertebral column.	False		C17269
92024	C16542	Embryology	Embryology	The branch of biology that studies the formation and early development of living organisms.	False		C16501
92027	C16543	Endocrinology	Endocrinology and Metabolism|Metabolism and Endocrinology|Endocrinology	The science and medical specialty concerned with the metabolism, physiology, or hormonal secretions and their physiologic and pathologic relations.	False		C16749
92177	C18247	Cancer Genetics	Cancer Genetics|Genetics of Cancer	Cancer Genetics; the science of heredity and the biological process of transmission of characteristics from progenitor to offspring, especially concerning a heritable predisposition to cancer susceptibility.	False		C18666
93315	C16954	Parasitology	Microbiology, Virology, Parasitology|Parasitology	A branch of biology which deals with parasitic organisms with a strong emphasis on their role in disease.	False		C201957
93320	C16958	Surgical Pathology	Surgical Pathology	A field of anatomical pathology in which tissue or cells removed from a living organism are macroscopically and microscopically reviewed for the purpose of disease diagnosis.	False		C18189
96117	C18132	Parallel Computing	Parallel Computing	Model for high performance computing in which a problem is solved by multiple processors working cooperatively and simultaneously.	False		C18149
97238	C19093	Tumor Cell Biology	Tumor Cell Biology	The study of the tumor cells at the microscopic and molecular level.	False		C19323
97240	C19095	Tumor Immunology	Tumor Immunology	Interactions of the immune system and tumor cells	False		C19323
97244	C19097	Tumor Pathology	Tumor Pathology	The medical science, and specialty practice, concerned with all aspects of tumor development, growth, and metastasis, but with special reference to the essential nature, causes, and development of abnormal conditions, as well as the structural and functional changes that result from the tumor.	False		C19323
98220	C17173	Surgery	Surgical Specialty|Surgical Specialties|Surgical Profession|Surgery	The branch of medical science that treats disease or injury by operative procedures.	False		C17153
98291	C16698	Human Genetics	Human Genetics	The branch of genetics focusing on human heredity.	False		C16624
98990	C91062	Image Quantification	Image Quantification	The process of measuring attributes of an image, by human sense or machine observations and experiences, and mapping them into members of some set of numbers or coded concepts.	False		C17606
100097	C153193	Lipidomics	Lipidomics	A study of the complete set of lipids produced in a given cell or organism under specific conditions.	False		C17964
104446	C105686	Neonatology	Neonatology	A branch of pediatric medicine focused on the diagnosis and treatment of newborns.	False		C16962
104480	C19102	Urologic Oncology	Urologic Oncology	The branch of oncology concerned with the study, diagnosis, and treatment of cancer of the genitourinary tract.	False		C17837
104483	C19100	Ultraviolet Radiation Biology	Ultraviolet Radiation Biology	The field of science that studies the biological effects of ultraviolet radiation.	False		C17055
106919	C20039	Hematology, Other	Hematology, Other	The medical specialty that pertains to the anatomy, physiology, pathology, symptomatology, and therapeutics related to the blood and blood-forming tissues.	False		C16673
107025	C18948	Polymer Chemistry	Polymer Chemistry	The study of synthesis and application of polymers.  Polymers are any of numerous natural and synthetic compounds of usually high molecular weight consisting of up to millions of repeated linked units, each a relatively light and simple molecule.	False		C16419
107489	C86575	Orthodontics	Orthodontics	The branch of dentistry dealing with the prevention or correction of irregularities of the teeth.	False		C52653
107634	C86070	Endodontics	Endodontics	The branch of dentistry dealing with diseases of the dental pulp.	False		C52653
108767	C119712	Proteogenomics	Proteogenomic Research|Proteogenomic Characterization|Proteogenomics|Proteogenomic Analysis	A method of study that relates annotated genomic information to global protein expression in order to determine the relationship between genomic sequences and both expressed proteins and predicted peptide sequences; these studies can identify novel coding regions.	False		C84343
109563	C19051	Surgery, Neonatal Pediatric	Surgery, Neonatal Pediatric	Surgery on neonates	False		C17851
109567	C19056	Invertebrate Taxonomy	Taxonomy, Invertebrate|Invertebrate Taxonomy	The systematic classification of invertebrates.	False		C17469
109568	C19059	Vertebrate Taxonomy	Vertebrate Taxonomy|Taxonomy, Vertebrate	The systematic classification of vertebrates.	False		C17469
109569	C19058	Plant Taxonomy	Plant Taxonomy|Taxonomy, Plant	The systematic classification of plants.	False		C17469
109570	C19057	Microbial Taxonomy	Taxonomy, Microbial|Microbial Taxonomy	The systematic classification of bacteria.	False		C17469
113252	C105685	Emergency Medicine	Emergency Medicine	The medical specialty concerned with the prompt diagnosis and treatment of injuries, trauma, or sudden illness.	False		C17153
115374	C19086	Transplacental Carcinogenesis	Transplacental Carcinogenesis	Studies of the mechanisms of induction of cancer in an individual by in utero exposure to a carcinogen.	False		C19941
116210	C48038	Integration	Integration	An operation used in calculus whereby the integral of a function is determined.	False		C47925
116498	C105694	General Surgery	General Surgery	A surgical specialty that focuses on surgical management of diseases of the abdominal organs.	False		C17173
116648	C19545	Interactive Communication	Interactive Communication		False		C19367
116870	C94918	Iterative Reconstruction	Iterative Reconstruction	A method of reconstruction used in PET and SPECT that repeats a series of calculation steps with image data such that there is an improvement in the image quality in each repetition. It is an alternative approach to filtered backprojection.	False		C17606
117505	C17759	Therapeutic Radiology	Radiology, Therapeutic|Therapeutic Radiology|Radiotherapy [Medical Specialty]	The medical specialty concerned with the use of electromagnetic or particulate radiation in the treatment of disease.	False		C17059
118069	C16673	Hematology	Hematologic|Hematology	The branch of medicine that deals with the blood and blood-forming organs and the diseases thereof.	False		C16749
118299	C19938	Arctic Research	Arctic Research	Health Research affecting Inuit/Eskimo populations.	False		C17039
118574	C182015	Pyramid Representation	Image Pyramid|Pyramid Representation|Pyramid	An image processing method where an image is decomposed into multi-resolution representations allowing for analysis and manipulation of the image over a range of spatial scales.	False		C17606
119577	C16550	Entomology	Entomology	Entomology; the branch of zoology that studies insects.	False		C18858
122992	C111303	Reconstruction of Raw Data Type	Reconstruction of Raw Data Type|RECONDAT	The type of mathematical process used to produce the displayed image from the raw k-space data obtained from the receiver circuitry.	False		C47925
123837	C18913	Oral Microbiology	Oral Microbiology	A microbiology subdiscipline concerned with microorganisms of the buccal cavity.	False		C16851
123840	C18914	Organometallic Chemistry	Organometallic Chemistry	The chemistry of organometallic compounds (compounds having bonds between one or more metal atoms and one or more carbon atoms of an organyl group).  This concerns the synthesis, structure, reactivity, and the properties of such compounds, and the chemical transformations they undergo.	False		C16419
124498	C18650	Biology of HIV Infection	Biology of HIV Infection	Delineate the molecular and cellular mechanisms of establishment and systemic spread of infection and their impact on disease progression.	False		C19112
125228	C16991	Comparative Physiology	Comparative Physiology	The study of similarities and differences of the vital processes of different organisms.	False		C19301
126115	C18979	Radiation Biology, Low Level Ionizing Radiation	Radiation Biology, Low Level Ionizing Radiation	The study of the mechanisms and biological effects of low level ionizing radiation.	False		C17055
126119	C18974	Protein/Amino Acid Biochemistry, Synthesis	Protein/Amino Acid Biochemistry, Synthesis	Protein synthesis occurs in the cell by translating the sequential codons in messenger RNAs into amino acid residues of a peptide chain.  This translation physically occurs in macromolecular complexes called ribosomes, pairing amino acid-carrying transfer RNA complexes with individual codons of the messenger RNA, transferring the elongating peptide to this tRNA-amino acid complex with formation of a peptide bond, releasing the previous tRNA, and translocating the messenger RNA to make the next codon available for pairing.  The process is then repeated until a termination codon is read and the peptide is released.	False		C19902
126121	C18972	Protein/Amino Acid Biochemistry, Degradation and Protease Chemistry	Protein/Amino Acid Biochemistry, Degradation and Protease Chemistry	The study of the molecules and mechanisms involved in the metabolism of proteins and amino acids with an emphasis on their processing and degradation.	False		C19902
126123	C18976	Pulmonary Pharmacology and Toxicology	Pulmonary Pharmacology and Toxicology|Pulmonary Pharmacology/Toxicology	A branch of pharmacology concerned with the effect of drugs on the lungs with an emphasis on the toxic effects of drugs on the lungs.	False		C18222
126124	C18973	Protein/Amino Acid Biochemistry, Enzymology	Protein/Amino Acid Biochemistry, Enzymology	The enzymes involved in the metabolism of proteins and amino acids.	False		C19902
126125	C18978	Radiation Biology, Electromagnetic Fields	Radiation Biology, Electromagnetic Fields	The study of the mechanisms and biological effects of electromagnetic fields.	False		C17055
126425	C129677	DNA Repair Kinetics	Repair Kinetics|DNA Repair Kinetics	The rate at which a cell can repair DNA.	False		C18491
126853	C19451	Nucleic Acid Biochemistry, Enzymology	Nucleic Acid Biochemistry, Enzymology	The branch of nucleic acid biochemistry concerned with the properties and actions of enzymes.	False		C19350
126855	C19454	Toxicology, Other	Toxicology, Other	This term is used as a form filler when there is no appropriate Toxicology term available.	False		C17206
126977	C201957	Infectious Disease Specialty	Infectious Disease Specialty|Infectious Disease	The medical specialty dealing with the diagnosis and treatment of infections.	False		C16749
127600	C20882	Trauma Nursing	Trauma Nursing	Critical Care Nursing specialty devoted to the care of the traumatically injured patient.	False		C17602
127605	C20888	Obstetrical Nursing	Obstetric Nursing|Obstetrical Nursing	Nursing care given to the pregnant patient before, during, or after childbirth.	False		C18827
127606	C20880	Perianesthesia Nursing	Perianesthesia Nursing	Nursing care of the patient under anesthesia and in the immediate post-anesthesia period.	False		C17602
127607	C20881	Emergency Room Nursing	Emergency Room Nursing|Emergency Nursing|ED Nursing|ER Nursing	The nursing specialty concerned with the care of patients in the emergency room.	False		C17602
128372	C19446	Red Blood Cell Structure/Function/Metabolism	Red Blood Cell Structure/Function/Metabolism	Cell biology concerned with structure and function of erythrocytes.	False		C16405
128803	C19500	RNA Biochemistry	Nucleic Acid Biochemistry, RNA - Ribonucleic Acid|RNA Biochemistry|Nucleic Acid Biochemistry, RNA	The branch of biochemistry that is specifically concerned with the structure, synthesis, and maintenance of RNA.	False		C19350
128859	C17035	Psychopathology	Psychopathology	The branch of pathology focusing on mental illness and abnormal behavior.	False		C18189
128861	C17039	Public Health	Public Health	The science and practice of protecting and improving the health of a community, as by preventive medicine, health education, control of communicable diseases, application of sanitary measures, and monitoring of environmental hazards.	False		C17153
129836	C18715	Comparative Biochemistry	Comparative Biochemistry	The study of the similarities and differences between different living organisms of the biological and physiological chemistry of the organisms. Used for the scientific discipline or the biochemical processes themselves. (from PSY94)	False		C19301
130369	C84343	Genomics	Genomics Research|Genomics|genomics	The study of the structure, function, expression, evolution, mapping and editing of genomes.	False		C17964
131952	C90448	Reproductive and Developmental Toxicology	Reproductive and Developmental Toxicology|Developmental and Reproductive Toxicology|DART|REPRO	The branch of pharmacology that deals with the nature and effects of poisonous substances on reproduction and development.	False		C17206
133205	C18810	Applied Genetics	Applied Genetics|Genetics, Applied	The application of genetics techniques to solve practical problems.	False		C16624
133206	C18811	Experimental Genetics	Experimental Genetics	Basic research in the field of genetics.	False		C16624
133208	C18816	Glycobiology	Glycobiology	The study of the structure, biosynthesis, biology, and evolution of sugars and saccharides.	False		C18676
133491	C86047	Anesthesiology	Anesthesiology	The medical specialty concerned with patient comfort before, during, and after surgery and other medical procedures, including administration of anesthesia.	False		C17153
134486	C94896	Filtered Backprojection	Filtered Backprojection|Backprojection	A method of reconstruction that sums individual contributions to a pixel (voxel) value from detected counts of all lines of response passing through this pixel (voxel). It is an alternative approach to iterative reconstruction. Associated with this process is also a filtering that removes undesirable artifacts.	False		C17606
134494	C94891	Electronic Collimation	Electronic Collimation	The use of coincidence with a pair of gammas giving a coincidence event in detectors 180 degrees apart in a PET scanner to define a line of response along which lies the location of the radiation emitting tracer. This differs from the use of slab collimators whose many holes define lines of response from a single gamma emission.	False		C17606
