	Class ID	Preferred Label	Synonyms	Definitions	Obsolete	Semantic Types	Parents
134546	C19014	Retrovirology	Retrovirology	The study of RNA viruses from the family Retroviridae, which copy their genomes into DNA by action of reverse transcriptase and insert them into the host genome.	False		C19120
135149	C153190	Epigenomics	Epigenomics	A study of the complete set of epigenetic modifications on the genetic material of a cell.	False		C84343
135958	C16487	Cytogenetics	cytogenetics|Cytogenetics|Cytogenetic	The branch of biology that studies the cellular aspects of heredity, especially the chromosomes. Includes the study of disease states caused by numerical and structural chromosome abnormalities.	False		C16624
137626	C115557	Clinical Trial Publication Policy	Clinical Trial Publication Policy|Pubs Policy|Publication Policy	The approved guidelines governing the publication of results from a clinical trial.	False		C17735
137944	C17964	Bioinformatics	Bioinformatics|Computational Biology|bioinformatics	Bioinformatics derives knowledge from computer analysis of biological data. These can consist of the information stored in the genetic code, but also experimental results from various sources, patient statistics, and scientific literature. Research in bioinformatics includes method development for storage, retrieval, and analysis of the data. Bioinformatics is a rapidly developing branch of biology and is highly interdisciplinary, using techniques and concepts from informatics, statistics, mathematics, chemistry, biochemistry, physics, and linguistics. It has many practical applications in different areas of biology and medicine. (M. Nilges and Jens P. Linge, Unite de Bio-informatique Structurale, Institut Pasteur, Paris)	False		C18145
138085	C16439	Clinical Informatics	Clinical Informatics|Health Informatics|Medical Informatics	The application of informatics methods to manage medical information and improve healthcare.	False		C18145
138388	C16801	Long-Term Care for Elderly	Long-Term Care for Elderly	Long-term care encompasses a broad range of help with daily activities that chronically disabled individuals need for a prolonged period of time.	False		C19155
139857	C18220	Human Biology	Human Biology	Interdisciplinary studies involving biology, anthropology, nutrition, and medicine with a focus on humans.	False		C19533
139965	C15889	Traditional Indigenous System	Traditional Indigenous System	Subcategory of Alternative Medical Systems in CAM. This sub-category refers to major indigenous systems of medicine other than acupuncture and traditional oriental medicine. It includes systems such as Ayurvedic medicine, Native American Medicine, Unani-Tibbi, Kampo, Traditional African systems and community based traditional medical systems. This sub-category may become subdivided further as these systems become better studied and more familiar in the U.S. Included are: Native American Medicine, Ayurvedic Medicine, Unani-Tibbi, SADHU, Kampo Medicine, Traditional African Medicine, Traditional Aboriginal Medicine, Curandersimo, Central and South American practices, Psychic surgery.	False		C180905
140312	C201964	Transplant Hepatology	Transplant Hepatology	A subspecialty of hepatology concerned with the special needs of liver transplant recipients.	False		C192581
140426	C105693	Sports Medicine	Sports Medicine	A medical specialty concerned with the diagnosis and treatment or injuries or illness resulting from athletic activities.	False		C17153
140665	C20626	Enzyme Kinetics	Enzyme Kinetics	A subdiscipline of Kinetics that studies the rates and mechanics of enzymes and enzyme-driven reactions.	False		C16770
140671	C20621	Hematopathology	Hematopathology	The branch of pathology concerned with diseases and disorders of the blood and blood-forming organs.	False		C18189
141551	C16931	Occupational Medicine	Occupational or Industrial Medicine|Occupational Medicine	This branch of medicine is concerned with the prevention, diagnosis, and treatment of injuries and illnesses that occur at the workplace or as a result of toxic exposures, stress, or accidents at the workplace. Occupational medicine encompasses issues such as industrial hygiene, safety, pollution control, ergonomics, industrial and agricultural toxicology, disability evaluation, physical rehabilitation, industrial psychology and emergency medicine. (BioTech Life Science Dictionary)	False		C17153
141554	C16939	Ophthalmology	Ophthalmology|OPHTHALMOLOGY|Ophthalmologic	A medical specialty concerned with the structure and function of the eye and the medical and surgical treatment of its defects and diseases.	False		C17153
142006	C19339	Optical Image Reconstruction	Reconstruction|Optical Image Reconstruction|Image Reconstruction	The process of generating an image from the raw data, or set of unprocessed measurements, made by an imaging system. (from AmershamHealth Medcyclopaedia)	False		C17606
142424	C18696	Child and Family Social Services	Child and Family Social Services		False		C17142
142428	C18694	Quantitative Chemistry	Chemistry, Quantitative|Quantitative Chemistry	A subdiscipline of chemistry concerned with the study of reaction rates and equilibrium states of chemical reaction	False		C16415
142890	C18988	Radiology, Head, Neck	Radiology, Head, Neck	A specialty concerned with the use of x-ray and other forms of radiant energy in the diagnosis and treatment of disease of the head and neck.	False		C17059
142892	C18989	Radiology, Soft Tissue	Radiology, Soft Tissue	A specialty concerned with the use of x-ray and other forms of radiant energy in the diagnosis and treatment of disease of soft tissue.	False		C17059
142894	C18985	Radioimmune Chemistry	Radioimmune Chemistry	A branch of chemistry concerned with radioimmunoconjugates.	False		C16713
142897	C18987	Radiology, Dental	Radiology, Dental		False		C17059
142898	C18986	Radiology, Bone	Radiology, Bone	A specialty concerned with the use of x-ray and other forms of radiant energy in the diagnosis and treatment of disease of the bone.	False		C17059
143361	C20126	Structural Genomics	Structural Genomics	The combination of computational DNA sequence analysis with structural determinations by X-ray crystallography and NMR techniques to study protein structural families. (from RFA: GM-99-009)	False		C84343
143367	C20121	Molecular Carcinogenesis	Molecular Carcinogenesis	Research that focuses on the genetics and mechanisms of cell transformation; the role of oxygen radicals in the carcinogenesis process; and identification and properties of tumor promoters and mechanisms of tumor promotion.	False		C18681
143368	C20122	Experimental Tobacco Carcinogenesis	Experimental Tobacco Carcinogenesis	Studies on the toxicology and pharmacology of smoking and tobacco-related exposures.  The research in this category is directed toward understanding the nature of the chemicals involved, and the reaction mechanisms behind, the deleterious effects of tobacco smoke and smokeless tobacco products.	False		C18681
144116	C17041	Public Policy	Public Policy	The basic policy or set of policies forming the foundation of public laws, especially such policy not yet formally enunciated. (dictionary.com)	False		C17735
144119	C17040	Public Health Nursing	Public Health Nursing	A discipline in nursing with a specific focus on health related concerns that can affect the general population; this includes high risk behaviors and communicable diseases.	False		C16456
144593	C192581	Hepatology	Hepatology	A branch of medicine concerned with disorders of the liver.	False		C16749
145932	C18479	Neuropathology	Neuropathology	The branch of pathology concerned with diseases and disorders of the nervous system.	False		C18189
146263	C19576	Nutritional Carcinogenesis	Nutritional Carcinogenesis	Basic studies on the etiologic effects of dietary macronutrients such as fat, vitamins and proteins; food mutagens and carcinogens formed during cooking; carcinogenic compounds and other substances closely associated with food preparation such as free radicals, fibers, and pyrolysis products; and digestive tract mutagens which form as a result of compound biodegradation, biotransformation, etc. The etiology of cancer resulting from deficiencies in the availability of various micronutrients, vitamins, metals, etc., is also of interest.	False		C18681
146264	C19571	Molecular Toxicology	Molecular Toxicology	The branch of toxicology that tries to understand the health effects of poisons by understanding the way that genes, proteins, and molecules interact.	False		C17206
147531	C142485	Data Mapping	Data Mapping|mapping	The process of connecting an item or symbol to a code or concept.	False		C47925
149400	C192382	Deformable Image Registration	Deformable Image Registration|Deformable Registration	An image registration process that can correct for changes in compared images by mapping between volume elements in one image and the corresponding volume elements in a subsequent image. Unlike rigid image registration, deformable image registration can account for non-linear displacements.	False		C80145
149458	C18465	Research Ethics	Research Ethics	The branch of ethics that studies moral values in research sciences and practices.	False		C39796
150207	C20085	Proteomics	Proteomics Research|Proteomic Research|Proteomics|proteomics	The global analysis of cellular proteins. Proteomics uses a combination of sophisticated techniques including two-dimensional (2D) gel electrophoresis, image analysis, mass spectrometry, amino acid sequencing, and bio-informatics to resolve comprehensively, to quantify, and to characterize proteins. The application of proteomics provides major opportunities to elucidate disease mechanisms and to identify new diagnostic markers and therapeutic targets.	False		C17964
150968	C82964	Computer Job	Computer Job|Job	A unit of work done by a computer consisting of a single complete task.	False		C62617
151129	C18870	Medical Radiation Physics	Medical Radiation Physics	The study of ionizing radiation and its effects on matter as it pertains to clinical use and practice.	False		C16922
151131	C18873	Microbial Physiology	Microbial Physiology	The metabolism of microbial life forms.	False		C16851
151132	C18874	Medical Microbiology	Medical Microbiology|Microbiology, Medical	The study of microorganisms with an emphasis on their role in the human disease process.	False		C16851
152314	C19023	School Health Nursing	School Nursing|School Health Nursing	Nursing care given to those in school settings	False		C16456
152319	C19025	Science Policy	Science Policy	The prioritizing of science projects by a government	False		C17735
153378	C20874	Medical-Surgical Nursing	Medical-Surgical Nursing|Med/Surg Nursing	Medical-Surgical Nursing includes the provision of care to individuals who have a known or predicted physiological alteration. Working within an interdisciplinary team and guided by theory and research, medical-surgical nursing practice considers all influences on health status and the related social and behavioral problems arising because of the patient's physiological condition.  Medical-surgical nursing is practiced in primary, acute, or long-term nursing care facilities. (from ANCC)	False		C20868
153380	C20876	Subacute Nursing	Subacute Care|Subacute Nursing|Sub-Acute Care	Comprehensive inpatient nursing care to treat one or more specific active complex medical conditions or to administer one or more technically complex treatments. Subacute care is generally more intensive than traditional nursing care and less intensive than acute care.	False		C20868
153381	C20877	Clinical Research Nursing	Clinical Research Nursing	Professional nursing care provided in a research environment.  Including management of clinical trials, direct patient care, and research assistance.	False		C20868
153383	C20879	OR Nursing	Perioperative Nursing|Surgical Nursing|Operating Room Nursing|OR Nursing	Nursing that is concerned with patient care during the preoperative, intraoperative, and postoperative phases of surgery.	False		C17602
153384	C20870	Long-Term Care Nursing	Long-Term Care Nursing|Nursing Home Nursing|LONG TERM NURSING CARE FACILITY	Professional nursing care provided in a long-term care/nursing facility to residents unable to provide for themselves a safe and adequate level of care.	False		C20868
153385	C20878	Flight Nursing	Flight Nursing	The provision of emergency or supportive nursing care to patients transported by helicopters or fixed-wing aircraft.	False		C17602
153386	C20875	Orthopedic Nursing	Orthopaedic Nursing|Orthopedic Nursing	Nursing care with a special emphasis on the care of individuals with orthopaedic-related injuries, diseases, and diagnoses.	False		C20868
153436	C18858	Invertebrate Biology	Invertebrate Biology	The science concerned with the origin, structure, development, growth, function, genetics, and reproduction of animals that have no spinal column.	False		C17269
153440	C18853	Inhalation Toxicology	Inhalation Toxicology	The branch of toxicology focusing on the health effects of inhaled poisons.	False		C17206
154091	C192371	Interventional Cardiology	Cardiovascular|Interventional Cardiology	A branch of cardiology concerned with the use of intravascular therapies, including coronary angioplasty and stenting, to treat disorders of the cardiovascular system.	False		C86055
154614	C105692	Pulmonary Medicine	Pulmonology|Pulmonary Medicine|Pulmonary	A medical specialty concerned with diagnosis and treatment of lung disorders and other breathing problems.	False		C16749
154664	C19268	Resource Informatics	Resource Informatics	The field of information science concerned with the analysis and dissemination of medical data through the application of computers to various resource aspects of health care and medicine.  Resources may include databases (drug structures, gene sequences, genealogical data, insurance records, tumor registries), software, cell or tissue banks, or other collections available for use in research.	False		C18145
155926	C19615	Neuropharmacology and Toxicology	Neuropharmacology / Toxicology|Neuropharmacology and Toxicology	Research into the mechanisms of drug action and cellular neurotoxicity in brain cells.	False		C18222
155928	C19613	Mammalian Genetics	Mammalian Genetics	The branch of science concerned with the means and consequences of transmission and generation of the components of biological inheritance in animals of the class Mammalia.	False		C16624
157883	C17381	Occupational Health	Occupational Health	The identification and control of risks and hazards in the workplace to establish and maintain a safe and healthy work environment.	False		C17039
159526	C17819	Experimental Hematology	Experimental Hematology	Basic research in the field of hematology.	False		C16673
162508	C17829	Gynecologic Oncology	Gynecologic Oncology|oncology, gynecologic	The branch of oncology that focuses on tumors of the reproductive tract of women.	False		C17837
163394	C17940	Microbial Genetics	Microbial Genetics	A branch of genetics concerned with the mechanisms and processes of heredity in microorganisms.	False		C16624
164292	C19118	Virology, DNA Viruses, Polyomavirus	Virology, DNA Viruses, Polyomavirus	The study of polyoma viruses and the diseases that they cause.	False		C19117
164293	C19112	Virology and Immunopathogenesis of HIV	Virology and Immunopathogenesis of HIV	Delineate the cellular and molecular mechanisms associated with the viral immunopathogenesis of HIV-related immune dysfunction.	False		C17256
164294	C19114	Virology, DNA Viruses, Adenovirus	Virology, DNA Viruses, Adenovirus	The study of adenoviruses and the diseases they cause.	False		C19115
164295	C19115	Virology, DNA Viruses, General	Virology, DNA Viruses, General	The study of DNA viruses.	False		C17256
164296	C19116	Virology, DNA Viruses, Papillomavirus	Virology, DNA Viruses, Papillomavirus	The study of papilloma viruses and the diseases that they cause.	False		C19117
164298	C19119	Virology, Human	Virology, Human	The study of those viruses that infect humans and the diseases they cause.	False		C17256
164299	C19113	Virology, Animal	Virology, Animal	The study of animal viruses and the diseases they cause.	False		C17256
164300	C19111	Viral Genetics	Viral Genetics	The branch of science concerned with the means and consequences of viral transmission and generation of the components of biological inheritance.	False		C16624
164301	C19117	Virology, DNA Viruses, Papovavirus	Virology, DNA Viruses, Papovavirus	The study of papova viruses and the diseases they cause.	False		C19115
164443	C28641	Hospice Nursing	End-of-life Nursing|Hospice Nursing	Nursing specialized in providing palliative care for terminally ill patients.  It includes support for both the patient and their family.	False		C20889
166049	C18961	Prostaglandin Pharmacology	Prostaglandin Pharmacology	The branch of pharmacology concerned with the chemistry, actions, and uses of prostaglandins.	False		C18936
166054	C18967	Protein Function	Protein Function	The action of enzymes, regulators, chaperones etc.	False		C19902
166055	C18964	Protein Chemistry	Peptide/Protein Chemistry|Protein Chemistry	The chemistry (synthesis, degradation, and modification) of proteins and peptides.	False		C19902
166454	C18809	Genetic Toxicology	Genetic Toxicology|GENTOX	Toxicology focusing on the effects of drugs on genetics material and the generation of mutations and cancer.	False		C17206
167559	C18778	Expedite Dissemination	Expedite Dissemination	Support research to identify existing gaps in communications approaches, identify existing strategies that are effective, and develop and test new and innovative communication strategies that will improve access to and use of state-of-the-art HIV information by all relevant target audiences. (FMB)	False		C16732
167921	C16942	Orthopedics	Orthopedic Surgical Profession|Orthopedic Surgery|Orthopedics|Orthopedic	The branch of surgery broadly concerned with the skeletal system (bones and joints).	False		C17173
167925	C16943	Otolaryngology	Otorhinolaryngology|Oto/Rhino/Laryngology|Ear, Nose, and Throat|Otolaryngology|ENT	A medical specialty concerned with the study and treatment of disorders of the ear, nose, and throat.	False		C17153
169700	C18098	Molecular Pathology	Molecular Pathology	Description of disease and disease processes based upon the underlying protein and genetic defects rather than by a description of morphology.	False		C18189
169703	C18094	Immunopathology	Immunopathology	The branch of pathology focusing on immune diseases.	False		C18189
170838	C19294	Parasitology, Other	Parasitology, Other	This term is used as a form filler when there is no appropriate Parasitology term available.	False		C16954
171575	C18491	Cell Cycle Kinetics	Cell Cycle Kinetics|Cell Kinetics	Cell cycle kinetics is the rate at which a cell progresses through the cell cycle.  It is a general indication of how fast a tissue or cell sample is proliferating.  This rate is generally increased in more aggressive tumors and can be measured by various biochemical methods such as the incorporation of labeled nucleotides into replicating DNA or the level of expression of cell cycle proteins or other proliferation markers.	False		C19372
174484	C19625	Cytoskeleton/Tumor Biology	Cytoskeleton/Tumor Biology	The study of the role of the cytoskeleton in the development and treatment of tumors and cancer.	False		C19093
174513	C105690	Podiatry	Podiatry	A medical specialty concerned with care and treatment of human feet in health and disease.	False		C17153
174615	C18826	Gynecologic Pathology	Gynecologic Pathology	The medical science and specialty practice concerned with all aspects of disease of the genital tract, endocrine system, and reproductive system of the female.	False		C18189
176989	C73932	Serialization	Serialization	The process of taking a data object and converting it to a format in which it can be transported across a network or persisted to a storage location.	False		C47925
176992	C73937	Commit Operation	Commit Operation|Commit|Save	The final step in the processing of a business transaction during which a business process is done. Examples of business processes include creation of a study or the registration of a patient into a study.	False		C62617
176994	C73933	Deserialization	Deserialization	The process of taking a data object from a transport operation or persisted storage location and converting it back to its original form.	False		C47925
176995	C73938	Rollback Operation	Rollback Operation|Rollback|Undo	A command to cancel a business process and return a record to its previous state.	False		C62617
177071	C18892	Mycology, Nonclinical	Mycology, Nonclinical	The study of fungus in a nonclinical environment, ie not as a pathogen	False		C16851
177074	C18898	Neurogenetics	Neurogenetics	A subdiscipline of genetics with a focus on nerve cells and the nervous system.	False		C16624
177401	C18832	Health Promotion in Nursing	Health Promotion in Nursing		False		C17011
177627	C16668	Health Policy	Health Policy	A set of decisions and courses of action undertaken to achieve specific health care goals within a community or society.	False		C17735
177938	C47929	Deconvolution	Deconvolution	Processing of signal parameters to exclude undesirable effects, including those caused by the detection instrument itself.	False		C47925
178041	C18192	Plastic Surgery	Plastic Surgery	The branch of surgery concerned with therapeutic or cosmetic reformation of tissue.	False		C17173
178162	C18633	Animal Genetics	Animal Genetics	The study of genetic traits in animals.	False		C16624
178165	C18636	Auditory Physiology	Auditory Physiology	The science concerned with the normal processes of hearing	False		C19029
178180	C18998	Repair Enzymology	DNA Repair Enzymology|Repair Enzymology	The study of the enzymes and mechanisms involved in the repair of damaged DNA.	False		C19451
178182	C18990	Radiology, Thorax, Chest	Radiology, Thorax, Chest	A specialty concerned with the use of x-ray and other forms of radiant energy in the diagnosis and treatment of disease of the thorax and chest.	False		C17059
178186	C18997	Renal/Urogenital Pathology	Renal/Urogenital Pathology	The medical science, and specialty practice, concerned with all aspects of disease of the kidney and general organs of reproduction and urination, but with special reference to the essential nature, causes, and development of abnormal conditions, as well as the structural and functional changes that result from the disease processes.	False		C18189
178187	C18991	Receptor Biology and Gene Expression	Receptor Biology and Gene Expression	The study of the regulation of gene expression by nuclear receptors.  Includes the mechanisms by which receptors are themselves regulated.	False		C16872
178286	C105688	Obstetrics and Gynecology	Obstetrics and Gynecology|OBG/GYN|OBGYN	A medical specialty concerned with the female reproductive organs in their pregnant and non-pregnant states.	False		C17153
179219	C19974	Biosynthetic Chemistry	Biosynthetic Chemistry	A branch of chemistry dealing with the biosynthesis of compounds.	False		C20609
179304	C16340	Biomedical Ethics	Biomedical Ethics|Bioethics	The branch of ethics that studies moral values in the biomedical sciences.	False		C39796
179306	C16347	Biostatistics	Biometry and Biostatistics|Biometry and Statistics|biostatistics|Biostatistics|Biometrics|Biometry|biometrics|biometry	The application of statistical methods to biological studies.	False		C17167
179866	C142636	Pharmacoeconomics	Pharmacoeconomics|pharmacoeconomics	A scientific discipline, and subdivision of Health Economics, that compares one pharmaceutical product or treatment to another with respect to various cost comparison measures.	False		C16527
180421	C18231	Communication Methods	Communication Methods		False		C19367
180455	C19366	Infection Control Nursing	Infectious Disease / Infection Control Nursing|Infection Control Nursing	A nursing specialty devoted to control and elimination of nosocomial infection risk in a clinical setting.  They do this through risk assessment, risk management, and staff education.	False		C20868
180879	C16902	Nephrology	Nephrology	A branch of medicine concerned with the development, anatomy, function, and dysfunction of the kidney.	False		C16749
180885	C16908	Neurology	Neurology	A branch of medicine concerned with the development, anatomy, function, and dysfunction of the nervous system.	False		C17153
181099	C18937	Pharmacology-Drug Structure	Pharmacology-Drug Structure	The relation of a drug structure to its activity.	False		C20634
181100	C18934	Pesticide Toxicology	Pesticide Toxicology	The toxicology of pesticides	False		C17206
181413	C16497	Dentistry	Dentistry	A clinical specialty responsible for the maintenance of teeth and the oral cavity, and for the medical management of any diseases or disorders associated with these tissues.	False		C17153
183181	C201963	Developmental and Behavioral Pediatrics	Developmental and Behavioral Pediatrics|Developmental Behavior Specialty	A subspecialty of pediatrics concerned with the prevention, diagnosis, and management of developmental difficulties and problematic behaviors in children, and in family dysfunctions that compromise a child's development.	False		C16962
183864	C19164	Experimental Pathology	Experimental Pathology	Experimental pathology; the study of disease processes by the manipulation of the natural state of an organism.	False		C18189
183868	C19165	Cancer Histology	Cancer Histology		False		C18666
183962	C18700	Clinical Endocrinology	Clinical Endocrinology	The clinical specialty of endocrinology that focuses on the endocrine organs and their role in physiology and pathology.	False		C16543
